{
  "$id": "https://collab.codes/schemas/agentPlannerL1/backend/2026-09-21-p1-backend-v1.2",
  "$schema": "https://json-schema.org/draft/2020-12/schema",
  "type": "object",
  "additionalProperties": false,
  "required": [
    "schemaVersion",
    "moduleName",
    "device",
    "sourceNeeds",
    "inventoryPresent",
    "endpoints",
    "usecases",
    "ports",
    "tables",
    "removed",
    "changes",
    "testSupport",
    "meta"
  ],
  "properties": {
    "schemaVersion": { "type": "string", "const": "2026-09-21-p1-backend-v1.2" },
    "moduleName": { "type": "string", "pattern": "^[a-z][A-Za-z0-9]*$" },
    "device": { "type": "string", "const": "web" },
    "sourceNeeds": { "type": "string", "minLength": 1 },
    "inventoryPresent": { "type": "boolean" },
    "endpoints": {
      "type": "array",
      "items": { "$ref": "#/$defs/endpoint" }
    },
    "usecases": {
      "type": "array",
      "items": { "$ref": "#/$defs/usecase" }
    },
    "ports": {
      "type": "array",
      "items": { "$ref": "#/$defs/port" }
    },
    "tables": {
      "type": "array",
      "items": { "$ref": "#/$defs/table" }
    },
    "removed": {
      "type": "array",
      "items": { "$ref": "#/$defs/removed" }
    },
    "changes": {
      "type": "array",
      "items": { "$ref": "#/$defs/change" }
    },
    "testSupport": {
      "type": "array",
      "items": { "$ref": "#/$defs/testSupportItem" }
    },
    "meta": { "$ref": "#/$defs/meta" }
  },
  "$defs": {
    "status": {
      "type": "string",
      "enum": ["toCreate", "toUpdate", "toRemove", "done"]
    },
    "noTable": {
      "type": "string",
      "enum": ["ok", "mdm", "none"]
    },
    "tableRefs": {
      "type": "array",
      "items": { "type": "string", "minLength": 1 }
    },
    "endpoint": {
      "type": "object",
      "additionalProperties": false,
      "required": ["route", "page", "kind", "usecaseRef", "status", "tableRefs", "noTable"],
      "properties": {
        "route": { "type": "string", "minLength": 1 },
        "page": { "type": "string", "minLength": 1 },
        "kind": { "type": "string", "enum": ["qry", "cmd"] },
        "usecaseRef": { "type": "string", "minLength": 1 },
        "status": { "$ref": "#/$defs/status" },
        "tableRefs": { "$ref": "#/$defs/tableRefs" },
        "noTable": { "$ref": "#/$defs/noTable" }
      }
    },
    "usecase": {
      "type": "object",
      "additionalProperties": false,
      "required": ["usecaseId", "entity", "operation", "ports", "status", "existing", "reason", "tableRefs", "noTable"],
      "properties": {
        "usecaseId": { "type": "string", "minLength": 1 },
        "entity": { "type": "string", "minLength": 1 },
        "operation": {
          "type": "string",
          "enum": ["list", "get", "create", "update", "transition", "delete", "custom"]
        },
        "ports": {
          "type": "array",
          "items": { "type": "string", "minLength": 1 }
        },
        "status": { "$ref": "#/$defs/status" },
        "existing": { "type": "string" },
        "reason": { "type": "string", "minLength": 1 },
        "tableRefs": { "$ref": "#/$defs/tableRefs" },
        "noTable": { "$ref": "#/$defs/noTable" }
      }
    },
    "port": {
      "type": "object",
      "additionalProperties": false,
      "required": ["portId", "entity", "status", "tableRefs", "noTable"],
      "properties": {
        "portId": { "type": "string", "minLength": 1 },
        "entity": { "type": "string", "minLength": 1 },
        "status": { "$ref": "#/$defs/status" },
        "tableRefs": { "$ref": "#/$defs/tableRefs" },
        "noTable": { "$ref": "#/$defs/noTable" }
      }
    },
    "table": {
      "type": "object",
      "additionalProperties": false,
      "required": ["tableId", "entity", "status", "tableRefs", "noTable"],
      "properties": {
        "tableId": { "type": "string", "minLength": 1 },
        "entity": { "type": "string", "minLength": 1 },
        "status": { "$ref": "#/$defs/status" },
        "tableRefs": { "$ref": "#/$defs/tableRefs" },
        "noTable": { "$ref": "#/$defs/noTable" }
      }
    },
    "removed": {
      "type": "object",
      "additionalProperties": false,
      "required": ["kind", "id", "status", "reason", "tableRefs", "noTable"],
      "properties": {
        "kind": { "type": "string", "enum": ["usecase", "port", "table"] },
        "id": { "type": "string", "minLength": 1 },
        "status": { "type": "string", "const": "toRemove" },
        "reason": { "type": "string", "minLength": 1 },
        "tableRefs": { "$ref": "#/$defs/tableRefs" },
        "noTable": { "$ref": "#/$defs/noTable" }
      }
    },
    "change": {
      "type": "object",
      "additionalProperties": false,
      "required": ["changeId", "kind", "op", "entity", "tableRefs", "noTable", "usecaseRefs", "reason", "source"],
      "properties": {
        "changeId": { "type": "string", "minLength": 1 },
        "kind": {
          "type": "string",
          "enum": ["field", "rule", "grant", "transition", "process", "integration", "entity"]
        },
        "op": { "type": "string", "enum": ["added", "changed", "removed"] },
        "entity": { "type": "string" },
        "tableRefs": { "$ref": "#/$defs/tableRefs" },
        "noTable": { "$ref": "#/$defs/noTable" },
        "usecaseRefs": {
          "type": "array",
          "items": { "type": "string", "minLength": 1 }
        },
        "reason": { "type": "string", "minLength": 1 },
        "source": { "type": "string", "minLength": 1 }
      }
    },
    "testSupportItem": {
      "type": "object",
      "additionalProperties": false,
      "required": ["id", "actorRefs", "entityRefs", "sourceRefs", "status", "owner", "executorRef", "cleanupRef", "gap"],
      "properties": {
        "id": { "type": "string", "minLength": 1 },
        "actorRefs": { "type": "array", "items": { "type": "string", "minLength": 1 } },
        "entityRefs": { "type": "array", "items": { "type": "string", "minLength": 1 } },
        "sourceRefs": { "type": "array", "items": { "type": "string", "minLength": 1 } },
        "status": { "$ref": "#/$defs/status" },
        "owner": { "type": "string", "enum": ["L1", "runtime"] },
        "executorRef": { "type": "string" },
        "cleanupRef": { "type": "string" },
        "gap": { "type": "string" }
      }
    },
    "meta": {
      "type": "object",
      "additionalProperties": false,
      "required": ["pages", "generatedAt", "llmCalled", "unmappedChanges"],
      "properties": {
        "pages": {
          "type": "object",
          "additionalProperties": {
            "type": "array",
            "items": { "type": "string" }
          }
        },
        "generatedAt": { "type": "string", "minLength": 1 },
        "llmCalled": { "type": "boolean" },
        "unmappedChanges": {
          "type": "array",
          "items": { "$ref": "#/$defs/unmappedChange" }
        }
      }
    },
    "unmappedChange": {
      "type": "object",
      "additionalProperties": false,
      "required": ["changeId", "kind", "source"],
      "properties": {
        "changeId": { "type": "string", "minLength": 1 },
        "kind": { "type": "string", "minLength": 1 },
        "source": { "type": "string" }
      }
    }
  }
}
