{
  "schemaVersion": "2026-09-21-p1-backend-v1.2",
  "moduleName": "controleEstoque",
  "device": "web",
  "sourceNeeds": "pool/l1/web/needs.json",
  "inventoryPresent": false,
  "endpoints": [
    {
      "route": "controleEstoque.movimentacoes.cmdCreateMovimentacaoEstoque",
      "page": "movimentacoes",
      "kind": "cmd",
      "usecaseRef": "createMovimentacaoEstoque",
      "status": "toCreate",
      "tableRefs": [
        "movimentacaoEstoque"
      ],
      "noTable": "ok"
    },
    {
      "route": "controleEstoque.movimentacoes.qryListMovimentacaoEstoque",
      "page": "movimentacoes",
      "kind": "qry",
      "usecaseRef": "listMovimentacaoEstoque",
      "status": "toCreate",
      "tableRefs": [
        "movimentacaoEstoque"
      ],
      "noTable": "ok"
    },
    {
      "route": "controleEstoque.movimentacoes.qryListProduto",
      "page": "movimentacoes",
      "kind": "qry",
      "usecaseRef": "listProduto",
      "status": "toCreate",
      "tableRefs": [],
      "noTable": "mdm"
    },
    {
      "route": "controleEstoque.produtos.cmdCreateMovimentacaoEstoque",
      "page": "produtos",
      "kind": "cmd",
      "usecaseRef": "createMovimentacaoEstoque",
      "status": "toCreate",
      "tableRefs": [
        "movimentacaoEstoque"
      ],
      "noTable": "ok"
    },
    {
      "route": "controleEstoque.produtos.cmdCreateProduto",
      "page": "produtos",
      "kind": "cmd",
      "usecaseRef": "createProduto",
      "status": "toCreate",
      "tableRefs": [],
      "noTable": "mdm"
    },
    {
      "route": "controleEstoque.produtos.qryListMovimentacaoEstoque",
      "page": "produtos",
      "kind": "qry",
      "usecaseRef": "listMovimentacaoEstoque",
      "status": "toCreate",
      "tableRefs": [
        "movimentacaoEstoque"
      ],
      "noTable": "ok"
    },
    {
      "route": "controleEstoque.produtos.qryListProduto",
      "page": "produtos",
      "kind": "qry",
      "usecaseRef": "listProduto",
      "status": "toCreate",
      "tableRefs": [],
      "noTable": "mdm"
    }
  ],
  "usecases": [
    {
      "usecaseId": "createMovimentacaoEstoque",
      "entity": "MovimentacaoEstoque",
      "operation": "create",
      "ports": [
        "MovimentacaoEstoque"
      ],
      "status": "toCreate",
      "existing": "",
      "reason": "no l1 usecase for MovimentacaoEstoque.create",
      "tableRefs": [
        "movimentacaoEstoque"
      ],
      "noTable": "ok"
    },
    {
      "usecaseId": "createProduto",
      "entity": "Produto",
      "operation": "create",
      "ports": [],
      "status": "toCreate",
      "existing": "",
      "reason": "no l1 usecase for Produto.create",
      "tableRefs": [],
      "noTable": "mdm"
    },
    {
      "usecaseId": "listMovimentacaoEstoque",
      "entity": "MovimentacaoEstoque",
      "operation": "list",
      "ports": [
        "MovimentacaoEstoque"
      ],
      "status": "toCreate",
      "existing": "",
      "reason": "no l1 usecase for MovimentacaoEstoque.list",
      "tableRefs": [
        "movimentacaoEstoque"
      ],
      "noTable": "ok"
    },
    {
      "usecaseId": "listProduto",
      "entity": "Produto",
      "operation": "list",
      "ports": [],
      "status": "toCreate",
      "existing": "",
      "reason": "no l1 usecase for Produto.list",
      "tableRefs": [],
      "noTable": "mdm"
    }
  ],
  "ports": [
    {
      "portId": "MovimentacaoEstoqueRepository",
      "entity": "MovimentacaoEstoque",
      "status": "toCreate",
      "tableRefs": [
        "movimentacaoEstoque"
      ],
      "noTable": "ok"
    }
  ],
  "tables": [
    {
      "tableId": "movimentacaoEstoque",
      "entity": "MovimentacaoEstoque",
      "status": "toCreate",
      "tableRefs": [
        "movimentacaoEstoque"
      ],
      "noTable": "ok"
    }
  ],
  "removed": [],
  "changes": [],
  "testSupport": [
    {
      "id": "data:MovimentacaoEstoque",
      "actorRefs": [
        "estoquista"
      ],
      "entityRefs": [
        "MovimentacaoEstoque",
        "Produto"
      ],
      "sourceRefs": [
        "grant:gerenciarEstoque",
        "journey:acompanharSaldos/consultarSaldos",
        "journey:acompanharSaldos/localizarProdutos",
        "journey:cadastrarProduto/informarProduto",
        "journey:registrarMovimentacaoEstoque/consultarSaldo",
        "journey:registrarMovimentacaoEstoque/localizarProduto",
        "journey:registrarMovimentacaoEstoque/registrarMovimentacao",
        "journey:tratarAvisoSaldoBaixo/consultarProdutoAvisado",
        "relationship:MovimentacaoEstoque/movimentacaoEstoqueProduto",
        "relationship:Produto/movimentacaoEstoqueProduto"
      ],
      "status": "toCreate",
      "owner": "L1",
      "executorRef": "",
      "cleanupRef": "",
      "gap": "FIXTURE_EXECUTOR_UNREFERENCED: no L1 fixture executor creates and removes movimentacaoEstoque rows by execution id"
    },
    {
      "id": "identity:estoquista",
      "actorRefs": [
        "estoquista"
      ],
      "entityRefs": [],
      "sourceRefs": [
        "access:actors/estoquista",
        "grant:gerenciarEstoque",
        "journey:acompanharSaldos/consultarSaldos",
        "journey:acompanharSaldos/localizarProdutos",
        "journey:cadastrarProduto/informarProduto",
        "journey:registrarMovimentacaoEstoque/consultarSaldo",
        "journey:registrarMovimentacaoEstoque/localizarProduto",
        "journey:registrarMovimentacaoEstoque/registrarMovimentacao",
        "journey:tratarAvisoSaldoBaixo/consultarProdutoAvisado",
        "relationship:MovimentacaoEstoque/movimentacaoEstoqueProduto",
        "relationship:Produto/movimentacaoEstoqueProduto"
      ],
      "status": "toCreate",
      "owner": "runtime",
      "executorRef": "",
      "cleanupRef": "",
      "gap": "PERSON_ENTITY_UNDECLARED: actor estoquista declares no personEntity; the test identity cannot be bound"
    },
    {
      "id": "mdm:Produto",
      "actorRefs": [
        "estoquista"
      ],
      "entityRefs": [
        "Produto"
      ],
      "sourceRefs": [
        "grant:gerenciarEstoque",
        "journey:acompanharSaldos/consultarSaldos",
        "journey:acompanharSaldos/localizarProdutos",
        "journey:cadastrarProduto/informarProduto",
        "journey:registrarMovimentacaoEstoque/consultarSaldo",
        "journey:registrarMovimentacaoEstoque/localizarProduto",
        "journey:registrarMovimentacaoEstoque/registrarMovimentacao",
        "journey:tratarAvisoSaldoBaixo/consultarProdutoAvisado",
        "ontology:MovimentacaoEstoque/relationships",
        "relationship:MovimentacaoEstoque/movimentacaoEstoqueProduto",
        "relationship:Produto/movimentacaoEstoqueProduto"
      ],
      "status": "toCreate",
      "owner": "runtime",
      "executorRef": "",
      "cleanupRef": "",
      "gap": "RUNTIME_MDM_FIXTURE_UNREFERENCED: no verified runtime capability provisions and removes Produto records by execution id"
    }
  ],
  "meta": {
    "pages": {
      "produtos": [
        "controleEstoque.produtos.cmdCreateMovimentacaoEstoque",
        "controleEstoque.produtos.cmdCreateProduto",
        "controleEstoque.produtos.qryListMovimentacaoEstoque",
        "controleEstoque.produtos.qryListProduto"
      ],
      "movimentacoes": [
        "controleEstoque.movimentacoes.cmdCreateMovimentacaoEstoque",
        "controleEstoque.movimentacoes.qryListMovimentacaoEstoque",
        "controleEstoque.movimentacoes.qryListProduto"
      ]
    },
    "generatedAt": "2026-09-28T17:39:16.221Z",
    "llmCalled": false,
    "unmappedChanges": []
  }
}
